{
  "interface_ip": "1.1.1.1",
  "interface_name": "wlp2s0",
  "period_length": 10,
  "period_start": "Sat Jul 29 12:55:48 2023",
  "stat": [
    {
      "ports": [
        {
          "details": [
            {
              "src": {
                "ip": "1.1.1.1",
                "port": 443
              },
              "src_count": 6
            }
          ],
          "port": 37343,
          "port_count": 6
        }
      ],
      "time": "Sat Jul 29 12:55:48 2023",
      "time_count": 6
    },
    {
      "ports": [
        {
          "details": [
            {
              "src": {
                "ip": "1.1.1.1",
                "port": 53
              },
              "src_count": 1
            }
          ],
          "port": 33793,
          "port_count": 1
        },
        {
          "details": [
            {
              "src": {
                "ip": "1.1.1.1",
                "port": 443
              },
              "src_count": 3
            }
          ],
          "port": 35588,
          "port_count": 3
        }
      ],
      "time": "Sat Jul 29 12:55:49 2023",
      "time_count": 4
    },
    {
      "ports": [
        {
          "details": [
            {
              "src": {
                "ip": "1.1.1.1",
                "port": 443
              },
              "src_count": 3
            }
          ],
          "port": 35588,
          "port_count": 3
        },
        {
          "details": [
            {
              "src": {
                "ip": "1.1.1.1",
                "port": 53
              },
              "src_count": 1
            }
          ],
          "port": 51534,
          "port_count": 1
        }
      ],
      "time": "Sat Jul 29 12:55:50 2023",
      "time_count": 4
    },
    {
      "ports": [],
      "time": "Sat Jul 29 12:55:51 2023",
      "time_count": 0
    },
    {
      "ports": [
        {
          "details": [
            {
              "src": {
                "ip": "1.1.1.1",
                "port": 443
              },
              "src_count": 3
            }
          ],
          "port": 35588,
          "port_count": 3
        },
        {
          "details": [
            {
              "src": {
                "ip": "1.1.1.1",
                "port": 53
              },
              "src_count": 1
            }
          ],
          "port": 50280,
          "port_count": 1
        }
      ],
      "time": "Sat Jul 29 12:55:52 2023",
      "time_count": 4
    },
    {
      "ports": [
        {
          "details": [
            {
              "src": {
                "ip": "1.1.1.1",
                "port": 443
              },
              "src_count": 3
            }
          ],
          "port": 35588,
          "port_count": 3
        },
        {
          "details": [
            {
              "src": {
                "ip": "1.1.1.1",
                "port": 53
              },
              "src_count": 1
            }
          ],
          "port": 40456,
          "port_count": 1
        }
      ],
      "time": "Sat Jul 29 12:55:53 2023",
      "time_count": 4
    },
    {
      "ports": [],
      "time": "Sat Jul 29 12:55:54 2023",
      "time_count": 0
    },
    {
      "ports": [
        {
          "details": [
            {
              "src": {
                "ip": "1.1.1.1",
                "port": 443
              },
              "src_count": 3
            }
          ],
          "port": 35588,
          "port_count": 3
        },
        {
          "details": [
            {
              "src": {
                "ip": "1.1.1.1",
                "port": 53
              },
              "src_count": 1
            }
          ],
          "port": 46970,
          "port_count": 1
        }
      ],
      "time": "Sat Jul 29 12:55:55 2023",
      "time_count": 4
    },
    {
      "ports": [],
      "time": "Sat Jul 29 12:55:56 2023",
      "time_count": 0
    },
    {
      "ports": [
        {
          "details": [
            {
              "src": {
                "ip": "1.1.1.1",
                "port": 53
              },
              "src_count": 1
            }
          ],
          "port": 33185,
          "port_count": 1
        }
      ],
      "time": "Sat Jul 29 12:55:57 2023",
      "time_count": 1
    }
  ],
  "stat_count": 27
}
